{
    "product_id": "SW_STRx_1B",
    "name": "STR Thermally Corrected Data",
    "thematic_areas": [],
    "description": "-",
    "link_files_http": "",
    "link_files_ftp": "",
    "link_vires_gui": "",
    "link_notebook": "",
    "link_hapi": "",
    "variables_table": "",
    "related_resources": "",
    "details": ""
}