{
    "product_id": "SW_ACCx_AE_2_",
    "name": "-",
    "thematic_areas": [],
    "description": "-",
    "link_files_http": "https://swarm-diss.eo.esa.int/#swarm/Level2daily/Latest_baselines/ACC/AE/",
    "link_files_ftp": "ftp://swarm-diss.eo.esa.int/Level2daily/Latest_baselines/ACC/AE/",
    "link_vires_gui": "",
    "link_notebook": "",
    "link_hapi": "",
    "variables_table": "",
    "related_resources": "",
    "details": ""
}